{
  "format": "pigforge.level-content",
  "schemaVersion": 1,
  "contentVersion": "terrain-v1",
  "goalZone": { "min": [12.0, -0.5, -2], "max": [16.0, 2.5, 2] },
  "bounds": { "min": [-30, -12, -8], "max": [30, 30, 8] },
  "spawns": [
    {
      "partTypeId": 2,
      "position": [-20.0, -3.5, 0],
      "angle": 0,
      "role": "part"
    },
    {
      "partTypeId": 2,
      "position": [0.0, -3.5, 0],
      "angle": 0,
      "role": "part"
    },
    {
      "partTypeId": 2,
      "position": [20.0, -3.5, 0],
      "angle": 0,
      "role": "part"
    },
    {
      "partTypeId": 5,
      "position": [4.0, -2.5, 0],
      "angle": 0,
      "role": "part"
    },
    {
      "partTypeId": 5,
      "position": [7.0, -1.5, 0],
      "angle": 0,
      "role": "part"
    },
    {
      "partTypeId": 5,
      "position": [10.0, -0.5, 0],
      "angle": 0,
      "role": "part"
    },
    {
      "partTypeId": 6,
      "position": [-18.125, -1.758, 0],
      "angle": 0.25,
      "role": "part"
    },
    {
      "partTypeId": 6,
      "position": [-6.934, 1.1, 0],
      "angle": 0.25,
      "role": "part"
    },
    {
      "partTypeId": 6,
      "position": [4.257, 3.957, 0],
      "angle": 0.25,
      "role": "part"
    }
  ]
}
