{
  "format": "pigforge.level-content",
  "schemaVersion": 1,
  "contentVersion": "bench-v1",
  "goalZone": { "min": [100.0, 100.0, -2], "max": [101.0, 101.0, 2] },
  "bounds": { "min": [-6.0, -6.0, -8], "max": [6.0, 6.0, 8] },
  "spawns": [
    {
      "partTypeId": 2,
      "position": [0.0, -3.5, 0],
      "angle": 0,
      "role": "part"
    }
  ]
}
